### ISSUE TITLE
AWS cluster network failed

### ISSUE THREAD

**Issue by He-Jingkai** [aojea/kindnet#15]
Hi, @aojea. Sorry to bother you again. I have a problem with setting up a cluster on aws vm's.
I cannot ping the pods on other nodes successfully. Inter-pod communication on the same node is successful.

Can you help me?

**Comment by aojea** [comment]
seems like some assymetric problem, or some ACLs or nat problem?

**Comment by He-Jingkai** [comment]
@aojea Hi, Ojea.
I try to ping a pod on node2 from node1.
Logs of node1.
```bash
# node2: 10.244.2.0/24
$ ip route
default via 172.31.16.1 dev ens5 
10.244.0.2 dev veth2f91d3bb scope host 
10.244.0.3 dev veth4a89037e scope host 
10.244.0.4 dev veth89699986 scope host 
10.244.0.5 dev veth9733637b scope host 
10.244.1.0/24 via 172.31.22.129 dev ens5 
10.244.2.0/24 via 172.31.31.26 dev ens5 
172.31.16.0/20 dev ens5 proto kernel scope link src 172.31.29.158

$ sudo tcpdump -I ens5
# excerpt
02:28:34.170216 IP ip-172-31-29-158.ec2.internal > ip-10-244-2-2.ec2.internal: ICMP echo request, id 22302, seq 26, length 64
02:28:35.194215 IP ip-172-31-29-158.ec2.internal > ip-10-244-2-2.ec2.internal: ICMP echo request, id 22302, seq 27, length 64
02:28:36.218202 IP ip-172-31-29-158.ec2.internal > ip-10-244-2-2.ec2.internal: ICMP echo request, id 22302, seq 28, length 64
```

But I can't catch these icmp packages on node2. 

My question is: Even without any security settings, switches on the network path may not necessarily route packets destined for `ip-10-244-2-2.ec2.internal` to `172.31.31.26`,  despite the settings on node1 `10.244.2.0/24 via 172.31.31.26 dev ens5`. How can I fix this?

**Comment by He-Jingkai** [comment]
@aojea 
Is it possible to solve above problem without adding an overlay. 
If not, if I want to add an overlay to kindnet to solve the problem above, what plan do you recommend? I have studied and tried VxLan plan, but, perhaps because of my poor knowledge, I haven't figured out a way other than connecting the vxlan device and the pods' veth's peer veth to the same bridge.
I have been troubled by this problem for many days, it is very important for me to build a k8s network using cni in ptp mode.😭😭😭

**Comment by aojea** [comment]
kindnet was created to work with kind, in a very simple environment, I've forked it into its own repo because some projects wanted to use it, but it's not meant to be used in production environments, so there is not going to be new features.
For something simple you can use flannel, if you need much advanced features cilum or calico use to be the most used CNIs
